{
  "$schema": "https://json-schema.org/draft/2020-12/schema",
  "$id": "https://localsetup.invalid/schemas/cloudflare-dns/dns-record-normalized.schema.json",
  "title": "Normalized Cloudflare DNS Record",
  "type": "object",
  "required": ["id", "name", "type", "content", "record_hash"],
  "properties": {
    "id": { "type": "string" },
    "zone_id": { "type": "string" },
    "zone_name": { "type": "string" },
    "name": { "type": "string" },
    "type": { "type": "string" },
    "content": { "type": "string" },
    "proxied": { "type": "boolean" },
    "ttl": { "type": "integer" },
    "priority": { "type": "integer" },
    "comment": { "type": ["string", "null"] },
    "tags": {
      "type": "array",
      "items": { "type": "string" }
    },
    "settings": {
      "type": "object",
      "additionalProperties": true
    },
    "meta": {
      "type": "object",
      "additionalProperties": true
    },
    "created_on": { "type": "string" },
    "modified_on": { "type": "string" },
    "comment_modified_on": { "type": ["string", "null"] },
    "tags_modified_on": { "type": ["string", "null"] },
    "provider_fields": {
      "type": "object",
      "additionalProperties": true
    },
    "record_hash": { "type": "string", "pattern": "^[a-f0-9]{64}$" }
  },
  "additionalProperties": true
}
